equipment_id,category,subcategory,brand,model,public_name,status_public,setup_domain,primary_role,analog_digital,mono_stereo,power_category,power_notes_public,data_quality_status,privacy_level,public_notes
EQP-0001,effect,distortion,Boss,DS-1-WH,DS-1 Distortion,owned,guitar_effect,raw_distortion,analog,mono,low_current_9v,9V DC center-negative; exact current to verify,sample,public_safe,Public-safe example item for a distortion soundchain.
EQP-0002,effect,chorus,Electro-Harmonix,Neo Clone,Neo Clone,owned,guitar_effect,chorus_texture,analog,mono,low_current_9v,9V DC center-negative; exact current to verify,sample,public_safe,Public-safe example item for modulation and alternative sounds.
EQP-0003,instrument,electric_guitar,Fender,Player Stratocaster SSS,Player Stratocaster SSS,owned,instrument,bright_single_coil_guitar,not_applicable,not_applicable,not_applicable,not_applicable,sample,public_safe,Public-safe example instrument entry.
EQP-0004,amplification,modeling_amp,Line 6,Catalyst 60,Catalyst 60,owned,amplification,clean_or_crunch_amp_platform,digital,mono,standard_amp_power,standard amp power supply,sample,public_safe,Public-safe example amp platform.
EQP-0005,recording_hardware,audio_interface,Steinberg,UR22C,UR22C,owned,recording,audio_interface_for_recording,digital,stereo,usb_powered,USB powered,sample,public_safe,Public-safe example recording hardware item.
